{"rallies": [{"ball_observation_count": 527, "bounce_count": 5, "confidence": 0.6518036622390883, "contact_count": 4, "duration_seconds": 10.471667, "end_time_seconds": 10.471667, "event_count": 10, "index": 0, "limitations": ["imported_existing_stage3_track", "imported_manual_stage4_events", "external_source_video", "surface_metadata_unavailable", "single_rally_import_read_only", "no_inference"], "player_count": 2, "rally_id": "rally_001", "schema_version": "rally_record.v1", "session_id": "nivel_a2_01", "source_end_frame": 526, "source_start_frame": 0, "start_time_seconds": 0.0, "status": "partial"}], "schema_version": "rallies.v1", "session_id": "nivel_a2_01", "status": "partial"}
